{
  "id": "core",
  "name": "Core Pack",
  "description": "Installed with the studio: the arena world, the car and arm robots, and the first lessons.",
  "version": "1.0.0",
  "requires": { "studio": "0.1.0" },
  "contents": {
    "worlds": ["worlds/arena.json"],
    "robots": ["robots/arm.urdf"],
    "lessons": [
      "lessons/01-drive-to-the-wall.md",
      "lessons/02-wave-the-arm.md",
      "lessons/03-fly-a-square.md"
    ]
  }
}
